{
  "projection_schema_version": "cx_document_library_projection.v1",
  "service_id": "nex-cx",
  "source": {
    "source_kind": "repository",
    "database_env": null,
    "redacted_database_url": null
  },
  "filters": {
    "filter_schema_version": "cx_document_library_query_filters.v1",
    "tenant_ref": {
      "type": "oa.tenant",
      "id": "tenant-a"
    },
    "owner_subject_ref": {
      "type": "oa.user",
      "id": "user-a"
    },
    "lifecycle_status": "ACTIVE"
  },
  "pagination": {
    "limit": 50,
    "returned": 1
  },
  "summary": {
    "document_count": 1,
    "summary_available_count": 1,
    "summary_embedding_available_count": 1
  },
  "documents": [
    {
      "document_library_schema_version": "cx_document_library_item.v1",
      "document_id": "11111111-1111-4111-8111-111111111111",
      "upload_id": "22222222-2222-4222-8222-222222222222",
      "tenant_ref": {
        "type": "oa.tenant",
        "id": "tenant-a"
      },
      "owner_subject_ref": {
        "type": "oa.user",
        "id": "user-a"
      },
      "uploaded_by_subject_ref": {
        "type": "oa.user",
        "id": "user-a"
      },
      "filename": "source.md",
      "content_type": "text/markdown",
      "size_bytes": 1024,
      "source_sha256": "1111111111111111111111111111111111111111111111111111111111111111",
      "classification": "internal",
      "lifecycle_status": "ACTIVE",
      "retrieval_policy": {
        "chunk_policy": "chunk_1000_100",
        "chunk_size": 1000,
        "chunk_overlap": 100,
        "bm25_tokenizer": "mecab_ko",
        "bm25_tokenizer_fallback": "korean_mixed_v1"
      },
      "created_at": "2026-08-10T00:00:00Z",
      "updated_at": "2026-08-10T00:00:00Z",
      "summary": {
        "available": true,
        "status": "READY",
        "document_summary_id": "33333333-3333-4333-8333-333333333333",
        "summary_text_sha256": "2222222222222222222222222222222222222222222222222222222222222222",
        "summary_preview": "Short safe summary preview.",
        "summary_char_count": 27,
        "model_profile_id": "mock-document-summary",
        "model_revision": "slice-0027",
        "updated_at": "2026-08-10T00:00:01Z"
      },
      "summary_embedding": {
        "available": true,
        "status": "READY",
        "summary_embedding_id": "44444444-4444-4444-8444-444444444444",
        "model_profile_id": "Qwen3-Embedding-4B",
        "model_revision": "BF16",
        "vector_dimension": 2560,
        "embedding_sha256": "3333333333333333333333333333333333333333333333333333333333333333",
        "created_at": "2026-08-10T00:00:02Z"
      },
      "processing": {
        "available": true,
        "latest_pipeline_run_id": "55555555-5555-4555-8555-555555555555",
        "status": "SUCCEEDED",
        "step_total": 6,
        "step_failed": 0,
        "updated_at": "2026-08-10T00:00:03Z"
      },
      "links": {
        "cx_document": "/api/v1/documents/11111111-1111-4111-8111-111111111111",
        "cx_summary": "/api/v1/documents/11111111-1111-4111-8111-111111111111/summary",
        "cx_summary_embedding": "/api/v1/documents/11111111-1111-4111-8111-111111111111/summary-embedding",
        "cx_processing_runs": "/api/v1/documents/11111111-1111-4111-8111-111111111111/processing/runs"
      },
      "metadata": {
        "raw_source_included": false,
        "raw_summary_included": false,
        "embedding_vector_included": false,
        "storage_path_redacted": true
      }
    }
  ],
  "metadata": {
    "owner_scoped": true,
    "raw_source_included": false,
    "raw_summary_included": false,
    "embedding_vector_included": false,
    "storage_path_redacted": true
  }
}
